{
  "$schema": "../../../config/enterprise.schema.json",
  "schemaVersion": 1,
  "enterprise": {
    "id": "huizhong",
    "displayName": "惠众消防集团",
    "shortName": "惠众消防"
  },
  "branding": {
    "productName": "惠众消防集团数字化管理平台",
    "themeColor": "#2563a6",
    "logoUrl": "/company-site/enterprise-assets/site/huizhong/huizhong-logo.png",
    "login": {
      "slogan": "消防管道与通风管道，项目协同更清晰。",
      "description": "惠众消防集团面向消防管道、通风管道及消防工程配套项目，围绕销售跟进、项目交付、物料与人员协同开展日常经营。",
      "siteTag": "消防工程配套",
      "announcement": "面向授权人员的企业协同入口",
      "headerLoginText": "企业登录",
      "authKicker": "企业协同",
      "authTitle": "登录企业系统",
      "authSafeNote": "授权账号",
      "authFootnote": "账号由企业统一创建",
      "primaryActionText": "登录",
      "secondaryActionText": "了解平台",
      "secondaryActionUrl": "/eiscore",
      "scrollCueText": "查看企业信息",
      "metricsSectionKicker": "企业概况",
      "metricsSectionTitle": "项目、物料与交付在同一条链路",
      "aboutSectionKicker": "公司简介",
      "capabilitiesSectionKicker": "业务体系",
      "capabilitiesSectionTitle": "从客户跟进到项目交付",
      "leadersSectionKicker": "联系惠众",
      "leadersSectionTitle": "联系惠众",
      "backgroundImage": "/company-site/enterprise-assets/site/huizhong/hero-cylinder-room.png",
      "carouselImages": [
        {
          "url": "/company-site/enterprise-assets/site/huizhong/hero-cylinder-room.png",
          "title": "消防设备",
          "subtitle": "气体灭火设备与项目配套"
        },
        {
          "url": "/company-site/enterprise-assets/site/huizhong/hero-engineering-inspection.png",
          "title": "项目服务",
          "subtitle": "技术支持与交付协同"
        }
      ],
      "footerText": "惠众消防集团 · 消防管道与通风管道项目协同",
      "icpText": ""
    }
  },
  "endpoints": {
    "publicBaseUrl": "https://huizong.eiscore.top",
    "apiBasePath": "/api",
    "agentBasePath": "/agent",
    "realtimeWsPath": "/ws"
  },
  "modules": {
    "hr": true,
    "materials": true,
    "apps": true,
    "company-site": false,
    "sales": true,
    "purchase": false,
    "production": false,
    "quality": false,
    "equipment": false,
    "decision": false,
    "mobile": true
  },
  "features": {
    "documentIntake": false,
    "enterpriseAi": true
  }
}
