{
  "schemaVersion": 1,
  "enterprise": {"id": "yayu", "displayName": "雅御科技", "shortName": "雅御"},
  "branding": {
    "productName": "雅御 EISCore",
    "themeColor": "#9a7b46",
    "surfaceColor": "#f7f0df",
    "logoUrl": "/enterprise-assets/yayu/yayu-red-fangsong-seal.png",
    "login": {
      "slogan": "让 AI 成为企业经营伙伴",
      "description": "以 EISCore 与行业 Agent 为技术底座，连接智能终端、企业数字化与产业场景。",
      "siteTag": "AI 产业运营服务",
      "backgroundImage": "/enterprise-assets/yayu/yayu-hero.webp",
      "announcement": "企业授权人员登录入口",
      "authTitle": "登录雅御工作区",
      "showSecondaryAction": false,
      "metrics": [], "trustBadges": [], "businessChain": [], "capabilities": [],
      "carouselImages": [], "leaders": [], "navItems": [],
      "footerText": "雅御 EISCore", "icpText": ""
    }
  },
  "endpoints": {"publicBaseUrl": "https://yayu.eiscore.top", "apiBasePath": "/api", "agentBasePath": "/agent", "realtimeWsPath": "/ws"},
  "modules": {"hr": true, "materials": true, "apps": true, "company-site": false, "sales": true, "purchase": true, "production": false, "quality": false, "equipment": false, "decision": false, "mobile": true},
  "features": {"documentIntake": false, "enterpriseAi": true, "materialsVisible": false, "purchaseVisible": false, "appCenterVisible": false, "salesShipping": false, "flashHarness": true, "sopCompact": true}
}
